{
  "view": "num_active_devices_weekly",
  "owner": "DataEngineering",
  "description": "This table contains a weekly history of active product devices and trips for external organizations",
  "database": "dataprep",
  "schema": [
    {
      "name": "week",
      "type": "date",
      "description": "The starting 'date' of the week in 'YYYY-mm-dd' format"
    },
    {
      "name": "product_id",
      "type": "long",
      "description": "The internal ID of the Samsara product"
    },
    {
      "name": "total_devices_heartbeats",
      "type": "long",
      "description": "The total number of product devices that had an active heartbeat in the calendar week"
    },
    {
      "name": "total_devices_trips",
      "type": "long",
      "description": "The total number of product devices with at least one trip on in the calendar week"
    }
  ],
  "dependencies": [
    {
      "dbname": "dataprep",
      "tablename": "active_devices",
      "type": "table"
    },
    {
      "external": true,
      "dbname": "clouddb",
      "tablename": "organizations",
      "type": "table"
    }
  ]
}
