{
  "view": "elite_orgs",
  "owner": "OPX",
  "description": "All orgs containing more than 2,000 active Devices total of any kind.",
  "database": "perf_infra",
  "schema": [
    {
      "name": "org_id",
      "type": "long",
      "description": "The ID of the Organization from clouddb.organizations."
    },
    {
      "name": "name",
      "type": "string",
      "description": "The name of the organization from clouddb.organizations."
    }
  ],
  "dependencies": [
    {
      "dbname": "clouddb",
      "tablename": "organizations",
      "type": "table"
    },
    {
      "dbname": "productsdb",
      "tablename": "devices",
      "type": "table"
    }
  ]
}
