{
  "view": "org_trip_city_count",
  "owner": "DataScience",
  "description": "The number of trips for each org that start or end in a city",
  "database": "dataproducts",
  "schema": [
    { "name": "org_id", "type": "long", "description": "$org_id_default_description" },
    { "name": "total_num_trips", "type": "long", "nullable": false, "description": "Total number of trips taken" },
    {
      "name": "num_trips_start_end_in_city",
      "type": "long",
      "description": "Number of trips starting and ending in the city"
    },
    {
      "name": "percent_trips_start_end_city",
      "type": "double",
      "description": "% of trips starting and ending in the city"
    }
  ],
  "dependencies": [
    {
      "external": true,
      "dbname": "trips2db_shards",
      "tablename": "trips",
      "type": "table"
    },
    {
      "dbname": "dataproducts",
      "tablename": "cities",
      "type": "table"
    }
  ]
}
