{
  "view": "mobile_media_queued_background_uploads",
  "owner": "Mobile",
  "description": "metrics for queued media uploads with background upload enabled",
  "database": "mobile_metrics",
  "schema": [
    {
      "name": "date",
      "type": "date"
    },
    {
      "name": "total_uploads",
      "type": "long"
    },
    {
      "name": "average_retries",
      "type": "double"
    },
    {
      "name": "duration_p95_ms",
      "type": "integer"
    },
    {
      "name": "duration_p99_ms",
      "type": "integer"
    },
    {
      "name": "duration_trimmed_mean_95",
      "type": "double"
    },
    {
      "name": "success_rate_overall",
      "type": "double"
    }
  ],
  "dependencies": [
    {
      "external": true,
      "dbname": "datastreams",
      "tablename": "mobile_logs",
      "type": "table"
    }
  ]
}
